[
  {
    "slug": "brisk-walk",
    "name": "Brisk Walk",
    "method": "pulse",
    "targetPatterns": [],
    "targetMuscles": [
      "calf",
      "quad",
      "glute"
    ],
    "durationSec": 240,
    "reps": 0,
    "perSide": false,
    "requiredEquipment": [
      [
        "none"
      ]
    ],
    "howTo": "Walk as if you are late for a bus you can still catch. Arms swing. Breathe through your nose if you can. Stop if you cannot talk in a full sentence.",
    "commonErrors": "Shuffling. This is a walk with purpose, not a wander to the water fountain.",
    "effortGuidance": "Easy. You should be warmer, not tired.",
    "contraindications": [],
    "id": "688a12f5-b309-5966-b937-4e1712551951",
    "provenanceDefault": {
      "confidence": "moderate",
      "basis": "judgement",
      "source": "Coach & AI Programming Guide \u00a74.3 \u2014 five-stage warm-up; this drill is judgement",
      "reviewed": "2026-09-01"
    }
  },
  {
    "slug": "easy-cycle",
    "name": "Easy Cycle",
    "method": "pulse",
    "targetPatterns": [],
    "targetMuscles": [
      "quad",
      "calf",
      "hamstring"
    ],
    "durationSec": 240,
    "reps": 0,
    "perSide": false,
    "requiredEquipment": [
      [
        "exercise-bike"
      ]
    ],
    "howTo": "Sit tall on the bike. Light resistance. Cadence you could hold while chatting. Knees track over the feet. Unclip or stop if the hips rock.",
    "commonErrors": "Mashing a heavy gear. This is temperature, not a threshold effort.",
    "effortGuidance": "Easy. A conversation pace.",
    "contraindications": [],
    "id": "e9a893e3-8594-50bd-9f08-caff14146ee2",
    "provenanceDefault": {
      "confidence": "moderate",
      "basis": "judgement",
      "source": "Coach & AI Programming Guide \u00a74.3 \u2014 five-stage warm-up; this drill is judgement",
      "reviewed": "2026-09-01"
    }
  },
  {
    "slug": "easy-row",
    "name": "Easy Row",
    "method": "pulse",
    "targetPatterns": [
      "hinge",
      "horizontal pull"
    ],
    "targetMuscles": [
      "lat",
      "hamstring",
      "quad"
    ],
    "durationSec": 240,
    "reps": 0,
    "perSide": false,
    "requiredEquipment": [
      [
        "rower"
      ]
    ],
    "howTo": "Legs, then hips, then arms. Reverse to come forward. The chain stays level. Stroke rate slow enough that the catch is quiet.",
    "commonErrors": "Yanking with the arms first. The legs start the stroke.",
    "effortGuidance": "Easy. Smooth and quiet, not a piece.",
    "contraindications": [],
    "id": "8d75ba10-4d82-51ca-ae5c-8e5e2a2670d1",
    "provenanceDefault": {
      "confidence": "moderate",
      "basis": "judgement",
      "source": "Coach & AI Programming Guide \u00a74.3 \u2014 five-stage warm-up; this drill is judgement",
      "reviewed": "2026-09-01"
    }
  },
  {
    "slug": "skip-rope",
    "name": "Skip Rope",
    "method": "pulse",
    "targetPatterns": [
      "calves"
    ],
    "targetMuscles": [
      "calf",
      "tibialis"
    ],
    "durationSec": 180,
    "reps": 0,
    "perSide": false,
    "requiredEquipment": [
      [
        "jump-rope"
      ]
    ],
    "howTo": "Soft knees. Turn the rope with the wrists, not the shoulders. Bounce an inch off the floor. If you trip, reset and keep it easy.",
    "commonErrors": "Donkey kicks and high elbows. Small bounces.",
    "effortGuidance": "Easy to moderate. Stop before you puff.",
    "contraindications": [],
    "id": "67bdf84a-35c2-528b-9b19-1a36ada1c49c",
    "provenanceDefault": {
      "confidence": "moderate",
      "basis": "judgement",
      "source": "Coach & AI Programming Guide \u00a74.3 \u2014 five-stage warm-up; this drill is judgement",
      "reviewed": "2026-09-01"
    }
  },
  {
    "slug": "ankle-rocks",
    "name": "Ankle Rocks",
    "method": "mobility",
    "targetPatterns": [
      "squat",
      "lunge"
    ],
    "targetMuscles": [
      "calf",
      "tibialis"
    ],
    "durationSec": 40,
    "reps": 8,
    "perSide": true,
    "requiredEquipment": [
      [
        "none"
      ]
    ],
    "howTo": "Half-kneeling. The front foot is flat. Drive that knee forward over the toes without lifting the heel. The hip stays over the back knee. Switch sides.",
    "commonErrors": "The heel pops. Shorten the range until the heel stays down.",
    "effortGuidance": "Easy. A stretch-pressure at the ankle, not a grind.",
    "contraindications": [],
    "id": "4c76d289-dbe4-5209-a87d-9dd3f83f69b6",
    "provenanceDefault": {
      "confidence": "moderate",
      "basis": "judgement",
      "source": "Coach & AI Programming Guide \u00a74.3 \u2014 five-stage warm-up; this drill is judgement",
      "reviewed": "2026-09-01"
    }
  },
  {
    "slug": "worlds-greatest-stretch",
    "name": "World's Greatest Stretch",
    "method": "mobility",
    "targetPatterns": [
      "lunge",
      "hinge",
      "squat"
    ],
    "targetMuscles": [
      "glute",
      "hamstring",
      "quad",
      "oblique"
    ],
    "durationSec": 60,
    "reps": 5,
    "perSide": true,
    "requiredEquipment": [
      [
        "none"
      ]
    ],
    "howTo": "Long lunge. Front foot flat, back knee off the floor. Put the same-side hand on the floor inside the front foot. Rotate that elbow to the ceiling and follow it with your eyes. Drop the elbow toward the instep, then stand out of it.",
    "commonErrors": "The front heel lifts and the back hip dumps. Keep the front heel heavy.",
    "effortGuidance": "Easy to moderate. This should not fatigue you.",
    "contraindications": [],
    "id": "e0fa1d30-30e6-5736-8064-1aafb4e28e10",
    "provenanceDefault": {
      "confidence": "moderate",
      "basis": "judgement",
      "source": "Coach & AI Programming Guide \u00a74.3 \u2014 five-stage warm-up; this drill is judgement",
      "reviewed": "2026-09-01"
    }
  },
  {
    "slug": "ninety-ninety-hip-switch",
    "name": "90/90 Hip Switch",
    "method": "mobility",
    "targetPatterns": [
      "squat",
      "lunge",
      "hinge"
    ],
    "targetMuscles": [
      "glute",
      "abductor",
      "adductor"
    ],
    "durationSec": 50,
    "reps": 6,
    "perSide": true,
    "requiredEquipment": [
      [
        "none"
      ]
    ],
    "howTo": "Sit. Front shin and back shin both at right angles. Tall spine. Flip both legs to the other side without using your hands if you can. Pause when both shins settle.",
    "commonErrors": "Collapsing through the low back to get the legs over. Stay tall even if the range is small.",
    "effortGuidance": "Easy. The hips rotate; the spine does not flop.",
    "contraindications": [],
    "id": "f75fd87a-ecb9-596c-aee6-52b71efdb435",
    "provenanceDefault": {
      "confidence": "moderate",
      "basis": "judgement",
      "source": "Coach & AI Programming Guide \u00a74.3 \u2014 five-stage warm-up; this drill is judgement",
      "reviewed": "2026-09-01"
    }
  },
  {
    "slug": "open-book-rotation",
    "name": "Open Book",
    "method": "mobility",
    "targetPatterns": [
      "horizontal push",
      "horizontal pull",
      "vertical push"
    ],
    "targetMuscles": [
      "chest_mid",
      "oblique",
      "back_lower"
    ],
    "durationSec": 50,
    "reps": 6,
    "perSide": true,
    "requiredEquipment": [
      [
        "none"
      ]
    ],
    "howTo": "Lie on your side, knees bent, arms stacked in front of you. The top arm draws an arc across the floor until the chest faces the ceiling. Let the head follow. The knees stay glued.",
    "commonErrors": "The knees open with the arm. Pin them with the other hand if they wander.",
    "effortGuidance": "Easy. Breathe into the ribs as they open.",
    "contraindications": [],
    "id": "9c847c41-ec70-519e-b961-7ffe01692163",
    "provenanceDefault": {
      "confidence": "moderate",
      "basis": "judgement",
      "source": "Coach & AI Programming Guide \u00a74.3 \u2014 five-stage warm-up; this drill is judgement",
      "reviewed": "2026-09-01"
    }
  },
  {
    "slug": "cat-camel",
    "name": "Cat-Camel",
    "method": "mobility",
    "targetPatterns": [
      "hinge",
      "core",
      "horizontal pull"
    ],
    "targetMuscles": [
      "back_lower",
      "abs_upper"
    ],
    "durationSec": 40,
    "reps": 8,
    "perSide": false,
    "requiredEquipment": [
      [
        "none"
      ]
    ],
    "howTo": "Hands under shoulders, knees under hips. Round the back and drop the head. Then let the belly sink and look forward without cranking the neck. Move segment by segment, not as a slam.",
    "commonErrors": "Only bending at the neck and the low back. Try to move the mid-back too.",
    "effortGuidance": "Easy. A morning stretch, not a loaded extension.",
    "contraindications": [
      "flexion-intolerant-back"
    ],
    "id": "bb411507-d444-50be-b164-5f166767d62f",
    "provenanceDefault": {
      "confidence": "moderate",
      "basis": "judgement",
      "source": "Coach & AI Programming Guide \u00a74.3 \u2014 five-stage warm-up; this drill is judgement",
      "reviewed": "2026-09-01"
    }
  },
  {
    "slug": "scapular-wall-slide",
    "name": "Scapular Wall Slide",
    "method": "mobility",
    "targetPatterns": [
      "vertical push",
      "vertical pull",
      "horizontal pull"
    ],
    "targetMuscles": [
      "trap_mid",
      "serratus",
      "delt_rear"
    ],
    "durationSec": 45,
    "reps": 8,
    "perSide": false,
    "requiredEquipment": [
      [
        "none"
      ]
    ],
    "howTo": "Back to a wall. Ribs down. Forearms on the wall in a goal-post. Slide the arms up without the low back peeling off. If the wrists leave the wall, stop there and come down.",